n shangcai place in henan	1-55293-B
n shangdu place in inner mongolia	13-61594-B
n shanghe place in shandong	13-60776-B
n shanglin place in guangxi	1-50640-B
n shangnan place in shaanxi	13-58362-B
n shangqiu district district in henan	13-57703-B
n shangrao district district in jiangxi	1-57461-B
n shangshui place in henan	13-60709-B
n shangsi place in guangxi	1-49702-B
n shangyi place in hebei	21-7619-B
n shangyu city in zhejiang	1-55358-B
n shangzhi city in heilongjiang	21-6927-B
n shangzhou city in shaanxi	13-59365-B
n shanhaiguan area in hebei	21-31235-B
n shanhua town in taiwan	14-3151-B
n shanlin village in taiwan	33-377-B
n shanshan place in xinjiang	63-34730-B
n shanshang village in taiwan	21-28486-B
n shanting area in shandong	21-28716-B
n shantou district district in guangdong	36-55853-B
n shanyang place in shaanxi	21-33438-B
n shanyin place in shanxi	21-33374-B
n shaodong place in hunan	63-19831-B
n shaoshan city in hunan	68-16648-B
n shaowu city in fujian	63-19896-B
n shaoxing district district in zhejiang	49-34570-B
n shaoyang district district in hunan	63-20032-B
n shashi city in hubei	37-15742-B
n shawan area in sichuan	37-16695-B
n shawan place in xinjiang	37-16631-B
n shaya place in xinjiang	37-17787-B
n shehong place in sichuan	20-35638-B
n shenchi place in shanxi	46-58425-B
n shenkang village in taiwan	4-61445-B,46-56930-B
n shenkeng village in taiwan	38-49288-B
n shenmu place in shaanxi	46-57961-B
n shennongjialin area in hubei	46-61662-B
n shenqiu place in henan	37-4672-B
n shenze place in hebei	38-50868-B
n shenzha place in tibet	43-43224-B
n sheqi place in henan	46-47807-B
n shetou village in taiwan	46-50587-B
n sheyang place in jiangsu	20-35947-B
n shibing place in guizhou	30-66410-B
n shidian place in yunnan	30-66346-B
n shifang place in sichuan	4-19867-B
n shihkang village in taiwan	46-6093-B
n shihlin area in taiwan	16-36164-B
n shihmen village in taiwan	46-10578-B
n shihtan village in taiwan	42-16311-B
n shihting village in taiwan	46-9377-B
n shihtzu village in taiwan	42-15985-B
n shijiazhuang district district in hebei	46-5768-B
n shijushan area in ningxia	46-4665-B
n shijushan city in ningxia	46-4589-B
n shilou place in shanxi	46-7449-B
n shiping place in yunnan	46-6029-B
n shiqian place in guizhou	46-10656-B
n shiqu place in sichuan	46-8292-B
n shiquan place in shaanxi	46-8227-B
n shiquanhe place in tibet	42-16236-B
n shishi city in fujian	46-9121-B
n shishou city in hubei	46-10966-B
n shitai place in anhui	46-4528-B
n shitanjing area in ningxia	46-8697-B
n shizhu tujiazu zizhixian place in sichuan	46-6916-B
n shizong place in yunnan	22-26285-B
n shou county county in anhui	16-39221-B
n shoufeng village in taiwan	16-39338-B
n shouguang city in shandong	16-38140-B
n shouning place in fujian	16-38392-B
n shouwangfen place in hebei	16-38956-B
n shouyang place in shanxi	16-39541-B
n shuangbai place in yunnan	66-66481-B
n shuangcheng city in heilongjiang	66-64670-B
n shuangfeng place in hunan	66-65371-B
n shuanghsi village in taiwan	66-67247-B
n shuanghu place in tibet	66-67182-B
n shuangliu place in sichuan	66-67090-B
n shuangpai place in hunan	66-67329-B
n shuangqiao area in sichuan	66-66676-B
n shuangyashan city in heilongjiang	67-2771-B
n shucheng place in anhui	53-30740-B
n shufu place in xinjiang	44-3343-B
n shuicheng place in guizhou	36-40014-B
n shuifu place in yunnan	36-40436-B
n shuili village in taiwan	36-47188-B
n shuilin village in taiwan	36-41834-B
n shuishang village in taiwan	36-37987-B
n shunchang place in fujian	68-24917-B
n shunde city in guangdong	68-23883-B
n shunyi place in beijing	68-26305-B
n shuyang place in jiangsu	37-18318-B
n sihong place in jiangsu	37-35589-B
n sihui city in guangdong	14-50881-B
n simao district district in yunnan	24-56061-B
n sinan place in guizhou	24-54450-B
n sinda place in tibet	43-30262-B
n siping district district in jilin	14-49426-B
n sishui place in shandong	37-35525-B
n siyang place in jiangsu	37-35704-B
n siziwang qi place in inner mongolia	14-48401-B
n songjiang place in shanghai	70-26505-B
n songpan place in sichuan	70-26740-B
n songxi place in fujian	70-26617-B
n songyang place in zhejiang	70-27488-B
n songzi place in hubei	70-26679-B
n ssuhu village in taiwan	14-51768-B
n suao town in taiwan	55-40135-B
n suibin place in heilongjiang	49-57026-B
n suichang place in zhejiang	62-35313-B
n suide place in shaanxi	49-56899-B
n suihua city in heilongjiang	49-56596-B
n suihua district district in heilongjiang	49-56663-B
n suijiang place in yunnan	49-56960-B
n suileng place in heilongjiang	49-57094-B
n suining place in hunan	49-56836-B
n suining place in jiangsu	45-55694-B
n suiping place in henan	62-35250-B
n suixi place in anhui	40-8084-B
n suixi place in guangdong	62-35381-B
n suiyang place in guizhou	49-57331-B
n sungshan area in taiwan	33-27775-B
n suning place in hebei	52-3307-B
n sunite youqi place in inner mongolia	55-38194-B
n sunite zuoqi place in inner mongolia	55-38299-B
n sunwu place in heilongjiang	19-14544-B
n susong place in anhui	20-609-B
n suxian district district in anhui	19-67701-B
n taan area in taiwan	17-14587-B
n taan village in taiwan	17-14919-B
n tacheng city in xinjiang	16-16750-B
n tacheng village in taiwan	17-12215-B
n tachia town in taiwan	17-28479-B
n tahe place in heilongjiang	16-17788-B
n tahsi town in taiwan	17-26037-B
n tahu village in taiwan	17-25964-B
n tai an district district in shandong	37-45957-B
n tai an place in liaoning	12-18568-B
n taian village in taiwan	37-46206-B
n taibai place in shaanxi	17-59820-B
n taicang city in jiangsu	17-55955-B
n taierzhuang area in shandong	12-17918-B
n taigu place in shanxi	17-60750-B
n taihe place in anhui	17-57228-B
n taihsi village in taiwan	12-19806-B
n taijiang place in guizhou	12-19104-B
n taikang place in henan	17-59122-B
n tailai place in heilongjiang	37-45323-B
n taimali village in taiwan	17-62691-B
n taining place in fujian	37-46281-B
n taipao city in taiwan	17-55802-B
n taipusi banner place in inner mongolia	17-56084-B
n taiqian place in henan	12-18009-B
n taishan city in guangdong	12-18631-B
n taishan village in taiwan	37-46498-B
n taishun place in zhejiang	37-48918-B
n taitung city in taiwan	12-19041-B
n taiwu village in taiwan	37-47429-B
n taixing city in jiangsu	37-48287-B
n taizhou district in zhejiang	12-18773-B
n tajen village in taiwan	62-52614-B
n tali city in taiwan	17-37204-B
n taliao village in taiwan	17-15482-B
n talin town in taiwan	17-22369-B
n tancheng place in shandong	63-24941-B
n tanei village in taiwan	17-6402-B
n tanggu area in tianjin	16-19050-B
n tanghai place in hebei	13-52390-B
n tanghe place in henan	13-52329-B
n tangshan district district in hebei	13-51586-B
n tangyin place in henan	39-15111-B
n tangyuan place in heilongjiang	39-14592-B
n tanshui town in taiwan	38-43644-B
n tantzu village in taiwan	39-62489-B
n taojiang place in hunan	34-2988-B
n taole place in ningxia	66-31353-B
n taoyuan place in hunan	34-3053-B
n taoyuan village in taiwan	34-3270-B
n tapi village in taiwan	17-12501-B
n tapu village in taiwan	17-12428-B
n tashe village in taiwan	17-29496-B
n tashu village in taiwan	17-23191-B
n tatsun village in taiwan	17-21995-B
n tatu village in taiwan	17-31821-B
n tatung area in taiwan	17-9112-B
n tatung village in taiwan	17-9373-B
n tawu village in taiwan	17-23504-B
n taya village in taiwan	17-39606-B
n tayuan village in taiwan	17-11039-B
n tengchong place in yunnan	69-54364-B
n tengzhou city in shandong	39-30837-B
n tian e place in guangxi	17-46610-B
n tianchang city in anhui	17-54348-B
n tiandeng place in guangxi	17-52439-B
n tiandong place in guangxi	43-37647-B
n tianjun place in qinghai	17-46672-B
n tianlin place in guangxi	43-37714-B
n tianquan place in sichuan	17-44122-B
n tianshui district district in gansu	17-49047-B
n tianyang place in guangxi	43-38450-B
n tianzhen place in shanxi	17-54282-B
n tianzhu place in guizhou	17-48466-B
n tiefa city in liaoning	65-3844-B
n tieli city in heilongjiang	65-2368-B
n tieling district district in liaoning	65-2672-B
n tienchung town in taiwan	43-37043-B
n tienliao village in taiwan	43-37226-B
n tienwei village in taiwan	43-37307-B
n toba place in tibet	18-36387-B
n tong an place in fujian	12-46496-B
n tongbai place in henan	34-5871-B
n tongcheng place in anhui	34-5563-B
n tongcheng place in hubei	62-9084-B
n tongde place in qinghai	12-47037-B
n tongguan place in shaanxi	39-64847-B
n tonghai place in yunnan	62-10619-B
n tonghe place in heilongjiang	62-10551-B
n tonghua district district in jilin	62-8312-B
n tongjiang city in heilongjiang	12-49008-B
n tongjiang place in sichuan	62-10482-B
n tongliang place in sichuan	64-30516-B
n tonglu place in zhejiang	34-5701-B
n tongnan place in sichuan	39-64782-B
n tongren place in qinghai	12-45379-B
n tongshan place in hubei	62-9367-B
n tongshan place in jiangsu	64-30200-B
n tongshi city in hainan	62-6854-B
n tongwei place in gansu	62-10683-B
n tongxiang city in zhejiang	34-5997-B
n tongxu place in henan	62-13843-B
n tongzi place in guizhou	34-5934-B
n toucheng town in taiwan	68-36841-B
n toufen town in taiwan	68-36175-B
n touliu city in taiwan	30-33745-B
n tounan town in taiwan	30-33806-B
n touwu village in taiwan	68-37192-B
n tsaochiao village in taiwan	62-18617-B
n tsaotun town in taiwan	54-14360-B
n tsochen village in taiwan	21-59578-B
n tsoying area in taiwan	21-59134-B
n tucheng city in taiwan	15-30166-B
n tuku town in taiwan	15-30968-B
n tumote youqi place in inner mongolia	15-33165-B
n tumote zuoqi place in inner mongolia	15-33270-B
n tunchang place in hainan	21-28112-B
n tungho village in taiwan	33-20322-B
n tunghsiao town in taiwan	62-15782-B
n tungkang town in taiwan	33-21009-B
n tunglo village in taiwan	64-30805-B
n tungshan village in taiwan	8-16181-B,33-17898-B
n tungshih town in taiwan	33-15401-B
n tungshih village in taiwan	33-15321-B,33-22215-B
n tungyin village in taiwan	33-18468-B
n tunliu place in shanxi	21-28319-B
n tuoketuo place in inner mongolia	26-51451-B
n tuokexun place in xinjiang	26-51574-B
n tuoli place in xinjiang	26-52539-B
n tzukuan village in taiwan	34-13134-B
n tzutung village in taiwan	54-27808-B
n wafangdian city in liaoning	43-10792-B
n waipu village in taiwan	16-46547-B
n wan county county in hebei	19-38158-B
n wanding city in yunnan	44-625-B
n wangan village in taiwan	32-46013-B
n wangcang place in sichuan	31-17482-B
n wangcheng place in hunan	32-45559-B
n wangdu place in hebei	32-47074-B
n wangjiang place in anhui	32-46366-B
n wangkui place in heilongjiang	32-45680-B
n wangmo place in guizhou	32-46868-B
n wanhua area in taiwan	54-47550-B
n wanjung village in taiwan	54-45698-B
n wanli village in taiwan	54-48108-B
n wanluan village in taiwan	54-44779-B
n wanning place in hainan	54-44567-B
n wanquan place in hebei	54-43618-B
n wanrong place in shanxi	54-45634-B
n wanshan area in guizhou	54-44695-B
n wantan village in taiwan	54-42981-B
n wanxian district district in sichuan	54-46990-B
n wanyuan city in sichuan	54-46290-B
n wei county county in hebei	18-48605-B
n weichang place in hebei	15-21780-B
n weifang district district in shandong	40-11117-B
n weihui city in henan	56-38861-B
n weinan district district in shaanxi	39-4955-B
n weishan place in shandong	24-18993-B
n weishi place in henan	20-42142-B
n weixin county county in guizhou	18-45074-B
n weiyuan place in gansu	39-5347-B
n weiyuan place in sichuan	18-48965-B
n wenbu place in tibet	30-31231-B
n wenchang place in hainan	30-28304-B
n wencheng place in zhejiang	30-28061-B
n wenfengzhen place in gansu	30-27737-B
n weng an place in guizhou	43-11964-B
n wenjiang district district in sichuan	39-22209-B
n wenjiang place in sichuan	39-22142-B
n wenling city in zhejiang	39-20587-B
n wenshan area in taiwan	30-27664-B
n wenshan place in yunnan	30-27600-B
n wenshang place in shandong	36-64969-B
n wenshui place in shanxi	30-29405-B
n wenxi place in shanxi	51-57094-B
n wu an city in hebei	35-45869-B
n wubu place in shaanxi	13-57-B
n wuchang place in hubei	35-47018-B
n wucheng place in shandong	35-45144-B
n wuchi town in taiwan	34-15656-B
n wuchieh village in taiwan	3-52913-B
n wuchiu village in taiwan	40-35154-B
n wuchuan city in guangdong	13-232-B
n wuchuan place in inner mongolia	35-46454-B
n wudalianchi city in heilongjiang	3-48659-B
n wudi place in shandong	40-54964-B
n wuding place in yunnan	35-45995-B
n wufeng place in hubei	3-49457-B
n wufeng village in taiwan	3-49657-B,67-45665-B
n wugang city in henan	53-32904-B
n wugang city in hunan	35-46394-B
n wugong place in shaanxi	35-44345-B
n wuhe place in anhui	3-51437-B
n wujiang city in jiangsu	13-888-B
n wujin place in jiangsu	35-49189-B
n wuku village in taiwan	3-53234-B
n wulai village in taiwan	40-34639-B
n wulan place in qinghai	40-38026-B
n wulate houqi place in inner mongolia	40-36258-B
n wulate qianqi place in inner mongolia	40-36151-B
n wulate zhongqi place in inner mongolia	40-36042-B
n wulian place in shandong	3-54250-B
n wulong place in sichuan	35-49541-B
n wuming place in guangxi	35-49604-B
n wuqi place in shaanxi	13-717-B
n wuqiang place in hebei	35-46805-B
n wuqiao place in hebei	13-827-B
n wuqing place in tianjin	35-47618-B
n wushan place in gansu	35-46333-B
n wushen qi place in inner mongolia	40-35392-B
n wusheng place in sichuan	35-44718-B
n wushi place in xinjiang	40-34508-B
n wusu place in xinjiang	40-37677-B
n wutai village in taiwan	67-45590-B
n wutongqiao area in sichuan	3-55161-B
n wuwei district district in gansu	35-45698-B
n wuxi place in sichuan	21-62920-B
n wuxiang place in shanxi	35-49418-B
n wuxuan place in guangxi	35-46057-B
n wuyang place in henan	53-32964-B
n wuyi place in hebei	35-49250-B
n wuyi place in zhejiang	35-48219-B
n wuyuan place in inner mongolia	3-47792-B
n wuzhai place in shanxi	3-49395-B
n wuzhi place in henan	35-49482-B
n wuzhou district district in guangxi	34-15251-B
n xia county county in shanxi	16-41572-B
n xiahe place in gansu	16-41045-B
n xiahuayuan area in hebei	1-62563-B
n xiajin place in shandong	16-41426-B
n xiangcheng place in henan	57-9755-B
n xiangcheng place in sichuan	63-29910-B
n xiangfen place in shanxi	57-9985-B
n xianghuangqi place in inner mongolia	65-7919-B
n xiangning place in shanxi	63-29981-B
n xiangshan place in zhejiang	59-23036-B
n xiangshui place in jiangsu	68-19113-B
n xiangtan district district in hunan	39-12341-B
n xiangxiang city in hunan	39-12809-B
n xiangyang district district in hubei	57-10118-B
n xiangyang place in hubei	57-10051-B
n xiangyin place in hunan	39-12877-B
n xiangyuan place in shanxi	57-9687-B
n xiangyun place in yunnan	46-63581-B
n xiangzhou place in guangxi	59-23106-B
n xianju place in zhejiang	4-28970-B
n xianning district in hubei	13-30035-B
n xianyang district district in shaanxi	13-30507-B
n xiaogan district district in hubei	19-9495-B
n xiaojin place in sichuan	21-1540-B
n xiaoshan city in zhejiang	55-16674-B
n xiaoyi city in shanxi	19-9924-B
n xiapu place in fujian	67-45174-B
n xiayi place in henan	16-41817-B
n xichong place in sichuan	57-13093-B
n xichou place in yunnan	57-20965-B
n xichuan place in henan	38-40300-B
n xide place in sichuan	14-8212-B
n xietongmen place in tibet	58-57485-B
n xifeng city in gansu	57-16553-B
n xihe place in gansu	57-14225-B
n xihua place in henan	57-21782-B
n xiji place in ningxia	57-14106-B
n xilin place in guangxi	57-18583-B
n xin an place in henan	30-46904-B
n xinan zhongsha islands by hainan	57-13694-B
n xinba erhu youqi place in inner mongolia	30-47495-B
n xinba erhu zuoqi place in inner mongolia	30-47615-B
n xincai place in henan	30-56196-B
n xinchang place in zhejiang	30-49201-B
n xincheng place in guangxi	24-50516-B
n xindu place in sichuan	30-57427-B
n xing an place in guangxi	53-23975-B
n xinghai place in qinghai	53-24871-B
n xinghe place in inner mongolia	53-23274-B
n xinghua city in jiangsu	53-23210-B
n xingping city in shaanxi	53-24482-B
n xingren place in guizhou	53-22950-B
n xingshan place in hubei	53-24417-B
n xingtai district district in hebei	63-15716-B
n xingtang place in hebei	56-32049-B
n xingwen place in sichuan	53-24599-B
n xinhe place in hebei	30-50943-B
n xinhe place in xinjiang	30-45207-B
n xinji city in hebei	61-33667-B
n xinjiang place in shanxi	30-53622-B
n xinjin place in sichuan	30-51065-B
n xinle city in hebei	30-50089-B
n xinlong place in sichuan	30-58473-B
n xinning place in hunan	30-47236-B
n xinshao place in hunan	30-57313-B
n xintai city in shandong	30-51002-B
n xintian place in hunan	30-52302-B
n xinxiang district district in henan	30-57563-B
n xinyang district district in henan	5-46953-B
n xinye place in henan	30-57810-B
n xinyi city in jiangsu	30-50883-B
n xinyuan place in xinjiang	30-51501-B
n xinzheng city in henan	30-57746-B
n xinzhou district district in shanxi	24-50764-B
n xinzhou place in hubei	30-51128-B
n xiping place in henan	57-16922-B
n xishan area in yunnan	57-16411-B
n xishui place in guizhou	51-18739-B
n xishui place in hubei	38-9069-B
n xiuwen place in guizhou	5-47922-B
n xiuwu place in henan	5-48225-B
n xiwuzhumuqin qi place in inner mongolia	57-20330-B
n xixia place in henan	57-16613-B
n xixiang place in shaanxi	57-23430-B
n xiyang place in shanxi	31-28536-B
n xuan en place in hubei	19-54612-B
n xuanhan place in sichuan	19-55101-B
n xuanhua place in hebei	19-54138-B
n xuanwei city in yunnan	19-54417-B
n xuanzhou city in anhui	19-54480-B
n xuchang district district in henan	58-3997-B
n xuecheng area in shandong	55-22185-B
n xunke place in heilongjiang	62-59382-B
n xunyang place in shaanxi	31-16626-B
n xunyi place in shaanxi	31-16565-B
n xupu place in hunan	39-55173-B
n xushui place in hebei	24-4274-B
n xuwen place in guangdong	24-4508-B
n xuyong place in sichuan	30-658-B
n xuzhou district district in jiangsu	24-3815-B
n ya an district district in sichuan	66-54939-B
n yadong place in tibet	3-59472-B
n yajiang place in sichuan	66-55561-B
n yakeshi city in inner mongolia	41-46407-B
n yan an district district in shaanxi	23-16751-B
n yanbian place in sichuan	71-7652-B
n yanchao village in taiwan	41-29004-B
n yancheng area in taiwan	71-6852-B
n yancheng place in henan	63-28151-B
n yanchuan place in shaanxi	23-17158-B
n yangcheng place in shanxi	66-35005-B
n yangchun city in guangdong	66-35520-B
n yangdong place in guangdong	66-35795-B
n yanggao place in shanxi	66-37038-B
n yanggu place in shandong	66-36679-B
n yangling area in shaanxi	34-29577-B
n yangmei town in taiwan	34-28250-B
n yangqu place in shanxi	66-35666-B
n yangshuo place in guangxi	66-35728-B
n yangxi place in guangdong	66-36614-B
n yangxin place in hubei	66-35457-B
n yangxin place in shandong	66-34748-B
n yangyuan place in hebei	66-34940-B
n yangzhong city in jiangsu	28-44614-B
n yanjin place in henan	23-17947-B
n yanjin place in yunnan	71-7203-B
n yanjing place in tibet	71-6484-B
n yanling place in henan	63-32625-B
n yanping village in taiwan	23-17225-B
n yanpu village in taiwan	71-6777-B
n yanqing place in beijing	23-17482-B
n yanshan place in hebei	71-6927-B
n yanshan place in yunnan	46-26958-B
n yanshou place in heilongjiang	23-16577-B
n yanshui town in taiwan	71-6990-B
n yantai district district in shandong	41-1905-B
n yanting place in sichuan	71-6547-B
n yanyuan place in sichuan	71-7325-B
n yanzhou city in shandong	7-22914-B
n yao an place in yunnan	18-42024-B
n yecheng place in xinjiang	54-51562-B
n yi an place in heilongjiang	5-24412-B
n yibin district district in sichuan	19-50606-B
n yichang district district in hubei	19-49554-B
n yicheng area in shandong	21-48673-B
n yicheng city in hubei	19-49218-B
n yicheng place in shanxi	51-23999-B
n yichuan place in henan	4-48647-B
n yichuan place in shaanxi	19-49416-B
n yichun city in heilongjiang	4-49525-B
n yichun district district in jiangxi	19-49876-B
n yijinhuo luo qi place in inner mongolia	4-52350-B
n yijun place in shaanxi	19-49157-B
n yilan place in heilongjiang	5-25720-B
n yiliang place in yunnan	19-50180-B,23-53497-B
n yilong place in sichuan	6-54534-B
n yima city in henan	51-14504-B
n yimen place in yunnan	31-28328-B
n yinan place in shandong	37-2634-B
n yingcheng city in hubei	25-59135-B
n yingjiang place in yunnan	45-2204-B
n yingjing place in sichuan	39-28061-B
n yingjisha place in xinjiang	54-1863-B
n yingko town in taiwan	70-58321-B
n yingshan place in hubei	54-3265-B
n yingshan place in sichuan	41-31162-B
n yinjiang tujiazu miaozu zizhixian place in guizhou	11-20521-B
n yishan place in guangxi	19-49353-B
n yishui place in shandong	37-2696-B
n yiwu place in xinjiang	4-48054-B
n yixing city in jiangsu	19-50118-B
n yiyang district district in hunan	45-2860-B
n yiyang place in henan	19-50781-B
n yiyuan place in shandong	37-2760-B
n yizhang place in hunan	19-50055-B
n yizheng city in jiangsu	6-54285-B
n yong an city in fujian	36-50134-B
n yongchang place in gansu	36-51574-B
n yongcheng place in henan	36-49936-B
n yongchuan district district in sichuan	36-50706-B
n yongchun place in fujian	36-51641-B
n yongde place in yunnan	36-51196-B
n yongdeng place in gansu	36-52302-B
n yongfu place in guangxi	36-52481-B
n yongji city in shanxi	36-52043-B
n yongji district district in jilin	36-49227-B
n yongjing place in gansu	36-53096-B
n yongkang city in zhejiang	36-51099-B
n yongnian place in hebei	36-51034-B
n yongning place in guangxi	63-14706-B
n yongning place in ningxia	36-50593-B
n yongping place in yunnan	36-50968-B
n yongren place in yunnan	36-48722-B
n yongshan place in yunnan	36-49504-B
n yongsheng place in yunnan	36-49085-B
n yongshou place in shaanxi	36-50003-B
n yongshun place in hunan	36-53243-B
n yongtai place in fujian	36-51905-B
n yongxing place in hunan	36-52544-B
n youxi place in fujian	21-8323-B
n youyu place in shanxi	12-23353-B
n yuan an place in hubei	62-60578-B
n yuanchang village in taiwan	6-63425-B
n yuanjiang city in hunan	37-4043-B
n yuanli town in taiwan	53-64153-B
n yuanlin town in taiwan	13-41922-B
n yuanling place in hunan	37-4242-B
n yuanmou place in yunnan	6-63294-B
n yuanping city in shanxi	11-33064-B
n yuanqu place in shanxi	15-57123-B
n yuanshan village in taiwan	13-41780-B
n yuanshi place in hebei	6-62701-B
n yuanyang place in henan	11-35820-B
n yuanyang place in yunnan	6-63508-B
n yucheng city in shandong	47-10168-B
n yucheng place in henan	55-54962-B
n yuchih village in taiwan	70-37271-B
n yuching village in taiwan	42-29402-B
n yuci city in shanxi	34-38772-B
n yuechi place in sichuan	21-37543-B
n yuepuhu place in xinjiang	21-37423-B
n yueqing city in zhejiang	34-49476-B
n yuexi place in anhui	21-37652-B
n yuexi place in sichuan	60-27608-B
n yuhang city in zhejiang	69-16043-B
n yuhuan place in zhejiang	42-31105-B
n yuli place in xinjiang	20-42203-B
n yuli town in taiwan	42-32275-B
n yulin district district in guangxi	42-30333-B
n yulin district district in shaanxi	34-38374-B
n yumen city in gansu	42-32344-B
n yumin place in xinjiang	56-56040-B
n yunan place in guangdong	70-30438-B
n yuncheng district district in shanxi	62-39820-B
n yuncheng place in shandong	63-29403-B
n yungan village in taiwan	36-50196-B
n yungching village in taiwan	36-53161-B
n yungkang city in taiwan	36-51099-B
n yunhe place in zhejiang	67-18047-B
n yunlong place in yunnan	67-19472-B
n yunmeng place in hubei	67-18109-B
n yunxi place in hubei	63-31640-B
n yunxiao place in fujian	67-19248-B
n yunyang place in sichuan	67-19137-B
n yuqing place in guizhou	69-15848-B
n yushe place in shanxi	34-38829-B
n yutai place in shandong	70-36689-B
n yutian place in hebei	42-31169-B
n yutian place in xinjiang	30-65016-B
n yuxi district district in yunnan	42-30936-B
n yuzhong place in gansu	34-38155-B
n yuzhou city in henan	47-10233-B
n za nang place in tibet	26-39164-B
n zaduo place in qinghai	67-4233-B
n zalute qi place in inner mongolia	26-39906-B
n zaoqiang place in hebei	34-21885-B
n zaoyang city in hubei	34-22194-B
n zedang place in tibet	40-1637-B
n zeku place in qinghai	40-1518-B
n zengcheng city in guangdong	16-26551-B
n zepu place in xinjiang	40-1577-B
n zhada place in tibet	32-67863-B
n zhalaiteqi place in jilin	26-39746-B
n zhalantun city in heilongjiang	26-39665-B
n zhangbei place in hebei	23-37706-B
n zhangjiakou district district in hebei	23-38576-B
n zhangpu place in fujian	39-55014-B
n zhangqiu city in shandong	47-63560-B
n zhangye district district in gansu	23-39957-B
n zhangzi place in shanxi	65-12912-B
n zhanhua place in shandong	37-25960-B
n zhanjiang city in guangdong	39-13047-B
n zhao an place in fujian	58-6831-B
n zhaodong city in heilongjiang	52-4764-B
n zhaojue place in sichuan	31-37362-B
n zhaoping place in guangxi	31-37158-B
n zhaosu place in xinjiang	31-37298-B
n zhaotong district district in yunnan	31-37503-B
n zhaoyuan place in heilongjiang	52-4835-B
n zhaozhou place in heilongjiang	52-4426-B
n zhashui place in shaanxi	33-45190-B
n zhecheng place in henan	33-44815-B
n zhen an place in shaanxi	64-54131-B
n zhenba place in shaanxi	64-54330-B
n zhenfeng place in guizhou	59-31035-B
n zheng an place in guizhou	35-35631-B
n zhengding place in hebei	35-35697-B
n zhenghe place in fujian	29-53992-B
n zhenglanqi place in inner mongolia	35-38953-B
n zhengning place in gansu	35-35871-B
n zhengxiangbai qi place in inner mongolia	35-39391-B
n zhengyang place in henan	35-39641-B
n zhenhai place in zhejiang	64-54857-B
n zhenjiang district district in jiangsu	64-54603-B
n zhenkang place in yunnan	64-54458-B
n zhenping place in henan	64-54393-B
n zhenping place in shaanxi	64-53918-B
n zhenyuan place in gansu	64-53802-B
n zhenyuan place in guizhou	64-55257-B
n zherong place in fujian	33-44880-B
n zhicheng city in hubei	33-38210-B
n zhidan place in shaanxi	24-44507-B
n zhiduo place in qinghai	37-24345-B
n zhijiang place in hubei	33-38318-B
n zhijin place in guizhou	50-40395-B
n zhongba place in tibet	4-41006-B
n zhongjiang place in sichuan	2-75089-B
n zhongmou place in henan	2-76011-B
n zhongning place in ningxia	2-68996-B
n zhongyang place in shanxi	3-0-B
n zhoucun area in shandong	13-12716-B
n zhoukou district in henan	13-11115-B
n zhouning place in fujian	13-11617-B
n zhouqu place in gansu	53-33447-B
n zhouzhi place in shaanxi	13-13839-B
n zhuanghe city in liaoning	54-21544-B
